<?xml version="1.0" encoding="UTF-8"?>

<format xmlns:xsi="http://www.w3.org/2001/XMLSchema-instance"
        xmlns="http://www.i-vortex.com/log-format"
        xsi:schemaLocation="http://www.i-vortex.com/log-format log-format.xsd">
    <name>Glassfish</name>
<!--
[#|2009-07-08T17:48:34.300+0400|INFO|glassfish|null|_ThreadID=14;_ThreadName=Thread-1;|felix.fileinstall.debug          1|#]
        <![CDATA[(?s)^[#\|\d{4}-\d{2}-\d{2}T\d{2}:\d{2}:\d{2}\.\d{3}[+-]\d{3}\|(\p{Upper}+)\|\s+([\w\._\-\|]+)\s+\[\s*(.+?)\]\s+(\d{2}:\d{2}:\d{2}[\.\,]\d{3})\s+\:\s+(.*)$]]>
-->
    <pattern>
        <![CDATA[(?s)\[#\|.{11}(.{12})[^|]+\|([^|]+)\|([^|]+)\|([^|]+)\|_ThreadID=(\d+);_ThreadName=([^;]+);([^|]*)?\|([^|\n]*)(?:\|#\])?]]>
    </pattern>
    <column name="Time" group="1"/>
    <column name="Level" group="2" indexable="true">
        <highlight value="ERROR" color="0xff0000"/>
        <highlight value="WARN" color="0x0000ff"/>
    </column>
    <column name="Category" group="4" indexable="true"/>
    <column name="ThreadID" group="5" indexable="true"/>
    <column name="Thread" group="6" indexable="true"/>
    <column name="ClassInfo" group="7" indexable="true"/>
    <message-column name="Message" group="8"/>
</format>
